0,Family Time,Spend more time with your family with this package.,1000,http://imgur.com/uaWvl5R.jpg,Packages
1,Vacation Time,Everybody needs a vacation sometimes!,10000,http://imgur.com/j6PEbo3.jpg,Packages
2,Career/Education Time,Finally get the time you deserve to achieve your goals and dreams!,100000,http://imgur.com/NAEHAbb.jpg,Packages
3,Hobby Time,Have hobbies and projects that you've been dying to finish? Get them done with this package.,5000,http://imgur.com/nGnBJ3F.jpg,Packages
4,Self-Care/Sleep,The most important person in your life has to be yourself.,7000,http://imgur.com/R1GjyAv.jpg,Packages
5,Men's Watch,This watch isn't only beautiful. It's perfect for the guy who loves to stay stylish,150,http://imgur.com/enjcB61.jpg,Watches
6,Women's Watch,This watch isn’t only beautiful it’s perfect for the woman who loves to stay stylish.,125,http://imgur.com/ABMO1Mt.jpg,Watches
7,Girl's Watch,For the little girl in your life who loves the gift of time.,65,http://imgur.com/b7tEOqE.jpg,Watches
8,Boy's Watch,For the little guy in your life who loves the gift of time.,65,http://imgur.com/9W253zW.jpg,Watches
9,Pick-A-Time,Go wherever you want. Whenever you want,50000,http://imgur.com/up32KE5.jpg,pat
10,Pick-a-Time,Choose any Time and Place,5000,http://imgur.com/up32KE5.jpg,pat